<?xml version="1.0" encoding="UTF-8"?>
<tns:reporterInput xmlns:tns="com.ibm.csi.npm.dvreportinput" xmlns:xsi="http://www.w3.org/2001/XMLSchema-instance" xsi:schemaLocation="com.ibm.csi.npm.dvreportinput input.xsd ">
  <tns:reporterId>10268</tns:reporterId>
  <tns:widgetConfigInput>
    <tns:widget>
      <tns:name>RankVariationTable1</tns:name>
      <tns:type>table</tns:type>
      <tns:adaptor>DVRankVariationTableAdaptor</tns:adaptor>
    </tns:widget>
    <tns:mediator>
      <tns:name>RankVariationMediator1</tns:name>
      <tns:type>rankVariationMediator</tns:type>
    </tns:mediator>
  </tns:widgetConfigInput>
  <tns:widgetConfigInput>
    <tns:widget>
      <tns:name>RankVariationChart1</tns:name>
      <tns:type>chart</tns:type>
    </tns:widget>
    <tns:mediator>
      <tns:name>RankVariationMediator1</tns:name>
      <tns:type>rankVariationMediator</tns:type>
    </tns:mediator>
  </tns:widgetConfigInput>
  
  <tns:widgetConfigInput>
    <tns:widget>
      <tns:name>RankVariationTable2</tns:name>
      <tns:type>table</tns:type>
      <tns:adaptor>DVRankVariationTableAdaptor</tns:adaptor>
    </tns:widget>
    <tns:mediator>
      <tns:name>RankVariationMediator2</tns:name>
      <tns:type>rankVariationMediator</tns:type>
    </tns:mediator>
  </tns:widgetConfigInput>
  <tns:widgetConfigInput>
    <tns:widget>
      <tns:name>RankVariationChart2</tns:name>
      <tns:type>chart</tns:type>
    </tns:widget>
    <tns:mediator>
      <tns:name>RankVariationMediator2</tns:name>
      <tns:type>rankVariationMediator</tns:type>
    </tns:mediator>
  </tns:widgetConfigInput>
  
  <tns:widgetConfigInput>
    <tns:widget>
      <tns:name>RankVariationTable3</tns:name>
      <tns:type>table</tns:type>
      <tns:adaptor>DVRankVariationTableAdaptor</tns:adaptor>
    </tns:widget>
    <tns:mediator>
      <tns:name>RankVariationMediator3</tns:name>
      <tns:type>rankVariationMediator</tns:type>
    </tns:mediator>
  </tns:widgetConfigInput>
  <tns:widgetConfigInput>
    <tns:widget>
      <tns:name>RankVariationChart3</tns:name>
      <tns:type>chart</tns:type>
    </tns:widget>
    <tns:mediator>
      <tns:name>RankVariationMediator3</tns:name>
      <tns:type>rankVariationMediator</tns:type>
    </tns:mediator>
  </tns:widgetConfigInput>
  
  <tns:widgetConfigInput>
    <tns:widget>
      <tns:name>RankVariationTable4</tns:name>
      <tns:type>table</tns:type>
      <tns:adaptor>DVRankVariationTableAdaptor</tns:adaptor>
    </tns:widget>
    <tns:mediator>
      <tns:name>RankVariationMediator4</tns:name>
      <tns:type>rankVariationMediator</tns:type>
    </tns:mediator>
  </tns:widgetConfigInput>
  <tns:widgetConfigInput>
    <tns:widget>
      <tns:name>RankVariationChart4</tns:name>
      <tns:type>chart</tns:type>
    </tns:widget>
    <tns:mediator>
      <tns:name>RankVariationMediator4</tns:name>
      <tns:type>rankVariationMediator</tns:type>
    </tns:mediator>
  </tns:widgetConfigInput>
  
  <tns:widgetConfigInput>
    <tns:widget>
      <tns:name>RankVariationTable5</tns:name>
      <tns:type>table</tns:type>
      <tns:adaptor>DVRankVariationTableAdaptor</tns:adaptor>
    </tns:widget>
    <tns:mediator>
      <tns:name>RankVariationMediator5</tns:name>
      <tns:type>rankVariationMediator</tns:type>
    </tns:mediator>
  </tns:widgetConfigInput>
  <tns:widgetConfigInput>
    <tns:widget>
      <tns:name>RankVariationChart5</tns:name>
      <tns:type>chart</tns:type>
    </tns:widget>
    <tns:mediator>
      <tns:name>RankVariationMediator5</tns:name>
      <tns:type>rankVariationMediator</tns:type>
    </tns:mediator>
  </tns:widgetConfigInput>
  
  <tns:widgetConfigInput>
    <tns:widget>
      <tns:name>RankVariationTable6</tns:name>
      <tns:type>table</tns:type>
      <tns:adaptor>DVRankVariationTableAdaptor</tns:adaptor>
    </tns:widget>
    <tns:mediator>
      <tns:name>RankVariationMediator6</tns:name>
      <tns:type>rankVariationMediator</tns:type>
    </tns:mediator>
  </tns:widgetConfigInput>
  <tns:widgetConfigInput>
    <tns:widget>
      <tns:name>RankVariationChart6</tns:name>
      <tns:type>chart</tns:type>
    </tns:widget>
    <tns:mediator>
      <tns:name>RankVariationMediator6</tns:name>
      <tns:type>rankVariationMediator</tns:type>
    </tns:mediator>
  </tns:widgetConfigInput>
</tns:reporterInput>
