<?xml version="1.0" encoding="UTF-8"?>
<tns:reporterInput xmlns:tns="com.ibm.csi.npm.dvreportinput" xmlns:xsi="http://www.w3.org/2001/XMLSchema-instance" xsi:schemaLocation="com.ibm.csi.npm.dvreportinput input.xsd ">
  <tns:reporterId>10287</tns:reporterId>
  <tns:widgetConfigInput>
    <tns:widget>
      <tns:name>PropertyHistory1Table</tns:name>
      <tns:type>table</tns:type>
      <tns:adaptor>PVLcResourceOverThrTableAdaptor</tns:adaptor>
    </tns:widget>
    <tns:mediator>
      <tns:name>PropertyHistory1Mediator</tns:name>
      <tns:type>rttMediator</tns:type>
    </tns:mediator>
    <tns:title>
      <tns:name>ThresholdViolation1Title</tns:name>
    </tns:title>
  </tns:widgetConfigInput>
  
  <tns:widgetConfigInput>
		<tns:widget>
			<tns:name>ResTimeSeries1Chart</tns:name>
			<tns:type>chart</tns:type>
		</tns:widget>
		<tns:mediator>
			<tns:name>ResTimeSeries1Mediator</tns:name>
			<tns:type>timeSeriesMediator</tns:type>
		</tns:mediator>
		<tns:title>
			<tns:name>ResTimeSeries1Title</tns:name>
		</tns:title>
	</tns:widgetConfigInput>
	
</tns:reporterInput>
