<?xml version="1.0" encoding="UTF-8"?>
<tns:reporterInput xmlns:tns="com.ibm.csi.npm.dvreportinput" xmlns:xsi="http://www.w3.org/2001/XMLSchema-instance" xsi:schemaLocation="com.ibm.csi.npm.dvreportinput input.xsd ">
  <tns:reporterId>95071</tns:reporterId>
  <tns:widgetConfigInput>
    <tns:widget>
      <tns:name>groupSummaryTable</tns:name>
      <tns:type>table</tns:type>
       <tns:adaptor>PVLcGroupSummaryTableAdaptor</tns:adaptor>
    </tns:widget>
    <tns:mediator>
      <tns:name>groupSummaryTableMediator</tns:name>
      <tns:type>rgstMediator</tns:type>
    </tns:mediator>
    <tns:title>
      <tns:name>reportTableTitle</tns:name>
    </tns:title>
  </tns:widgetConfigInput>
  
  <tns:widgetConfigInput>
    <tns:widget>
      <tns:name>RatioChart1</tns:name>
      <tns:type>chart</tns:type>
    </tns:widget>
    <tns:mediator>
      <tns:name>RatioMediator1</tns:name>
      <tns:type>ratioMediator</tns:type>
    </tns:mediator>
  </tns:widgetConfigInput>
  
  <tns:widgetConfigInput>
    <tns:widget>
      <tns:name>RatioChart2</tns:name>
      <tns:type>chart</tns:type>
    </tns:widget>
    <tns:mediator>
      <tns:name>RatioMediator2</tns:name>
      <tns:type>ratioMediator</tns:type>
    </tns:mediator>
  </tns:widgetConfigInput>
</tns:reporterInput>