<?xml version="1.0" encoding="UTF-8"?>
<tns:reporterInput xmlns:tns="com.ibm.csi.npm.dvreportinput" xmlns:xsi="http://www.w3.org/2001/XMLSchema-instance" xsi:schemaLocation="com.ibm.csi.npm.dvreportinput input.xsd ">
  <tns:reporterId>25641</tns:reporterId>
  <tns:widgetConfigInput>
    <tns:widget>
      <tns:name>Chart1</tns:name>
      <tns:type>chart</tns:type>
    </tns:widget>
    <tns:mediator>
      <tns:name>Chart1Mediator</tns:name>
      <tns:type>timeSeriesMediator</tns:type>
    </tns:mediator>
  </tns:widgetConfigInput>
  
  <tns:widgetConfigInput>
    <tns:widget>
      <tns:name>Chart2</tns:name>
      <tns:type>chart</tns:type>
    </tns:widget>
    <tns:mediator>
      <tns:name>Chart2Mediator</tns:name>
      <tns:type>timeSeriesMediator</tns:type>
    </tns:mediator>
  </tns:widgetConfigInput>
  
  <tns:widgetConfigInput>
    <tns:widget>
      <tns:name>Chart3</tns:name>
      <tns:type>chart</tns:type>
    </tns:widget>
    <tns:mediator>
      <tns:name>Chart3Mediator</tns:name>
      <tns:type>timeSeriesMediator</tns:type>
    </tns:mediator>
  </tns:widgetConfigInput>
  
  <tns:widgetConfigInput>
    <tns:widget>
      <tns:name>Chart4</tns:name>
      <tns:type>chart</tns:type>
    </tns:widget>
    <tns:mediator>
      <tns:name>Chart4Mediator</tns:name>
      <tns:type>timeSeriesMediator</tns:type>
    </tns:mediator>
  </tns:widgetConfigInput>
  
  <tns:widgetConfigInput>
    <tns:widget>
      <tns:name>Chart5</tns:name>
      <tns:type>chart</tns:type>
    </tns:widget>
    <tns:mediator>
      <tns:name>Chart5Mediator</tns:name>
      <tns:type>timeSeriesMediator</tns:type>
    </tns:mediator>
  </tns:widgetConfigInput>
  
  <tns:widgetConfigInput>
    <tns:widget>
      <tns:name>Chart6</tns:name>
      <tns:type>chart</tns:type>
    </tns:widget>
    <tns:mediator>
      <tns:name>Chart6Mediator</tns:name>
      <tns:type>timeSeriesMediator</tns:type>
    </tns:mediator>
  </tns:widgetConfigInput>
  
  <tns:widgetConfigInput>
    <tns:widget>
      <tns:name>RatioChart1</tns:name>
      <tns:type>chart</tns:type>
    </tns:widget>
    <tns:mediator>
      <tns:name>RatioChartMediator1</tns:name>
      <tns:type>ratioMediator</tns:type>
    </tns:mediator>     
  </tns:widgetConfigInput> 
  
    <tns:widgetConfigInput>
    <tns:widget>
      <tns:name>RatioChart2</tns:name>
      <tns:type>chart</tns:type>
    </tns:widget>
    <tns:mediator>
      <tns:name>RatioChartMediator2</tns:name>
      <tns:type>ratioMediator</tns:type>
    </tns:mediator>     
  </tns:widgetConfigInput>  
  
</tns:reporterInput>
