<?xml version="1.0" encoding="UTF-8"?>
<tns:reporterInput xmlns:tns="com.ibm.csi.npm.dvreportinput" xmlns:xsi="http://www.w3.org/2001/XMLSchema-instance" xsi:schemaLocation="com.ibm.csi.npm.dvreportinput input.xsd ">
  <tns:reporterId>10285</tns:reporterId>
  <tns:widgetConfigInput>
    <tns:widget>
      <tns:name>ResDistrib1Chart</tns:name>
      <tns:type>chart</tns:type>
    </tns:widget>
    <tns:mediator>
      <tns:name>ResDistrib1Mediator</tns:name>
      <tns:type>resourceDistributionMediator</tns:type>
    </tns:mediator>
    <tns:title>
      <tns:name>ResDistrib1Title</tns:name>
    </tns:title>
  </tns:widgetConfigInput>
  <tns:widgetConfigInput>
    <tns:widget>
      <tns:name>ResDistrib2Chart</tns:name>
      <tns:type>chart</tns:type>
    </tns:widget>
    <tns:mediator>
      <tns:name>ResDistrib2Mediator</tns:name>
      <tns:type>resourceDistributionMediator</tns:type>
    </tns:mediator>
    <tns:title>
      <tns:name>ResDistrib2Title</tns:name>
    </tns:title>
  </tns:widgetConfigInput>
  <tns:widgetConfigInput>
    <tns:widget>
      <tns:name>ResSummary1Table</tns:name>
      <tns:type>table</tns:type>
      <tns:adaptor>PVLcResourceSummaryTableAdaptor</tns:adaptor>
    </tns:widget>
    <tns:mediator>
      <tns:name>ResSummary1Mediator</tns:name>
      <tns:type>rstMediator</tns:type>
    </tns:mediator>
    <tns:title>
      <tns:name>ResSummary1Title</tns:name>
    </tns:title>
  </tns:widgetConfigInput>
   <tns:widgetConfigInput>
    <tns:widget>
      <tns:name>ResSummary2Table</tns:name>
      <tns:type>table</tns:type>
      <tns:adaptor>PVLcResourceSummaryTableAdaptor</tns:adaptor>
    </tns:widget>
    <tns:mediator>
      <tns:name>ResSummary2Mediator</tns:name>
      <tns:type>rstMediator</tns:type>
    </tns:mediator>
    <tns:title>
      <tns:name>ResSummary2Title</tns:name>
    </tns:title>
  </tns:widgetConfigInput>
</tns:reporterInput>
