<?xml version="1.0" encoding="UTF-8"?>
<tns:reporterInput xmlns:tns="com.ibm.csi.npm.dvreportinput" xmlns:xsi="http://www.w3.org/2001/XMLSchema-instance" xsi:schemaLocation="com.ibm.csi.npm.dvreportinput input.xsd ">
  <tns:reporterId>69144</tns:reporterId>
  
   <tns:widgetConfigInput>
    <tns:widget>
      <tns:name>GroupSummary1Table</tns:name>
      <tns:type>table</tns:type>
      <tns:adaptor>PVLcGroupSummaryTableAdaptor</tns:adaptor>
    </tns:widget>
    <tns:mediator>
      <tns:name>GroupSummary1Mediator</tns:name>
      <tns:type>gstMediator</tns:type>
    </tns:mediator>   
    <tns:title>
      <tns:name>GroupSummary1Title</tns:name>
    </tns:title>  
  </tns:widgetConfigInput> 
  <tns:widgetConfigInput>
    <tns:widget>
      <tns:name>GTS1Chart</tns:name>
      <tns:type>chart</tns:type>
    </tns:widget>
    <tns:mediator>
      <tns:name>GTS1Mediator</tns:name>
      <tns:type>timeSeriesMediator</tns:type>
    </tns:mediator>
    <tns:title>
      <tns:name>GroupTimeSeries1Title</tns:name>
    </tns:title>
  </tns:widgetConfigInput>
  
   <tns:widgetConfigInput>
    <tns:widget>
      <tns:name>GTS2Chart</tns:name>
      <tns:type>chart</tns:type>
    </tns:widget>
    <tns:mediator>
      <tns:name>GTS2Mediator</tns:name>
      <tns:type>timeSeriesMediator</tns:type>
    </tns:mediator>
    <tns:title>
      <tns:name>GroupTimeSeries2Title</tns:name>
    </tns:title>
  </tns:widgetConfigInput>
  
   <tns:widgetConfigInput>
    <tns:widget>
      <tns:name>GTS3Chart</tns:name>
      <tns:type>chart</tns:type>
    </tns:widget>
    <tns:mediator>
      <tns:name>GTS3Mediator</tns:name>
      <tns:type>timeSeriesMediator</tns:type>
    </tns:mediator>
    <tns:title>
      <tns:name>GroupTimeSeries3Title</tns:name>
    </tns:title>
  </tns:widgetConfigInput>
  
   <tns:widgetConfigInput>
    <tns:widget>
      <tns:name>GTS4Chart</tns:name>
      <tns:type>chart</tns:type>
    </tns:widget>
    <tns:mediator>
      <tns:name>GTS4Mediator</tns:name>
      <tns:type>timeSeriesMediator</tns:type>
    </tns:mediator>
    <tns:title>
      <tns:name>GroupTimeSeries4Title</tns:name>
    </tns:title>
  </tns:widgetConfigInput>
  
   <tns:widgetConfigInput>
    <tns:widget>
      <tns:name>GTS5Chart</tns:name>
      <tns:type>chart</tns:type>
    </tns:widget>
    <tns:mediator>
      <tns:name>GTS5Mediator</tns:name>
      <tns:type>timeSeriesMediator</tns:type>
    </tns:mediator>
    <tns:title>
      <tns:name>GroupTimeSeries5Title</tns:name>
    </tns:title>
  </tns:widgetConfigInput>
 
  <tns:widgetConfigInput>
    <tns:widget>
      <tns:name>GTS6Chart</tns:name>
      <tns:type>chart</tns:type>
    </tns:widget>
    <tns:mediator>
      <tns:name>GTS6Mediator</tns:name>
      <tns:type>timeSeriesMediator</tns:type>
    </tns:mediator>
    <tns:title>
      <tns:name>GroupTimeSeries6Title</tns:name>
    </tns:title>
  </tns:widgetConfigInput>
  
  <tns:widgetConfigInput>
    <tns:widget>
      <tns:name>Ratio1Chart</tns:name>
      <tns:type>chart</tns:type>
    </tns:widget>
    <tns:mediator>
      <tns:name>Ratio1Mediator</tns:name>
      <tns:type>ratioMediator</tns:type>
    </tns:mediator>
    <tns:title>
      <tns:name>Ratio1Title</tns:name>
    </tns:title>
  </tns:widgetConfigInput>
  <tns:widgetConfigInput>
    <tns:widget>
      <tns:name>Ratio2Chart</tns:name>
      <tns:type>chart</tns:type>
    </tns:widget>
    <tns:mediator>
      <tns:name>Ratio2Mediator</tns:name>
      <tns:type>ratioMediator</tns:type>
    </tns:mediator>
    <tns:title>
      <tns:name>Ratio2Title</tns:name>
    </tns:title>
  </tns:widgetConfigInput>
 
</tns:reporterInput>
