<?xml version="1.0" encoding="UTF-8"?>
<tns:reporterInput xmlns:tns="com.ibm.csi.npm.dvreportinput" xmlns:xsi="http://www.w3.org/2001/XMLSchema-instance" xsi:schemaLocation="com.ibm.csi.npm.dvreportinput input.xsd ">
  <tns:reporterId>10291</tns:reporterId>
  <tns:widgetConfigInput>
    <tns:widget>
      <tns:name>TopNTable1</tns:name>
      <tns:type>table</tns:type>
      <tns:adaptor>PVLcSummaryTableAdaptor</tns:adaptor>
    </tns:widget>
    <tns:mediator>
      <tns:name>TopNMediator1</tns:name>
      <tns:type>topnMediator</tns:type>
    </tns:mediator>
    <tns:title>
      <tns:name>reportTableTitle1</tns:name>
    </tns:title>
  </tns:widgetConfigInput>
  <tns:widgetConfigInput>
    <tns:widget>
      <tns:name>TopNChart1</tns:name>
      <tns:type>chart</tns:type>
    </tns:widget>
    <tns:mediator>
      <tns:name>TopNChartMediator1</tns:name>
      <tns:type>topnMediator</tns:type>
    </tns:mediator>
    <tns:title>
      <tns:name>TopNChartTitle1</tns:name>
    </tns:title>
  </tns:widgetConfigInput>
  
  <tns:widgetConfigInput>
    <tns:widget>
      <tns:name>TopNTable2</tns:name>
      <tns:type>table</tns:type>
      <tns:adaptor>PVLcSummaryTableAdaptor</tns:adaptor>
    </tns:widget>
    <tns:mediator>
      <tns:name>TopNMediator2</tns:name>
      <tns:type>topnMediator</tns:type>
    </tns:mediator>
    <tns:title>
      <tns:name>reportTableTitle2</tns:name>
    </tns:title>
  </tns:widgetConfigInput>
  <tns:widgetConfigInput>
    <tns:widget>
      <tns:name>TopNChart2</tns:name>
      <tns:type>chart</tns:type>
    </tns:widget>
    <tns:mediator>
      <tns:name>TopNChartMediator2</tns:name>
      <tns:type>topnMediator</tns:type>
    </tns:mediator>
    <tns:title>
      <tns:name>TopNChartTitle2</tns:name>
    </tns:title>
  </tns:widgetConfigInput>
  
  
  <tns:widgetConfigInput>
    <tns:widget>
      <tns:name>TopNTable3</tns:name>
      <tns:type>table</tns:type>
      <tns:adaptor>PVLcSummaryTableAdaptor</tns:adaptor>
    </tns:widget>
    <tns:mediator>
      <tns:name>TopNMediator3</tns:name>
      <tns:type>topnMediator</tns:type>
    </tns:mediator>
    <tns:title>
      <tns:name>reportTableTitle3</tns:name>
    </tns:title>
  </tns:widgetConfigInput>
  <tns:widgetConfigInput>
    <tns:widget>
      <tns:name>TopNChart3</tns:name>
      <tns:type>chart</tns:type>
    </tns:widget>
    <tns:mediator>
      <tns:name>TopNChartMediator3</tns:name>
      <tns:type>topnMediator</tns:type>
    </tns:mediator>
    <tns:title>
      <tns:name>TopNChartTitle3</tns:name>
    </tns:title>
  </tns:widgetConfigInput>
  
  <tns:widgetConfigInput>
    <tns:widget>
      <tns:name>TopNTable4</tns:name>
      <tns:type>table</tns:type>
      <tns:adaptor>PVLcSummaryTableAdaptor</tns:adaptor>
    </tns:widget>
    <tns:mediator>
      <tns:name>TopNMediator4</tns:name>
      <tns:type>topnMediator</tns:type>
    </tns:mediator>
    <tns:title>
      <tns:name>reportTableTitle4</tns:name>
    </tns:title>
  </tns:widgetConfigInput>
  <tns:widgetConfigInput>
    <tns:widget>
      <tns:name>TopNChart4</tns:name>
      <tns:type>chart</tns:type>
    </tns:widget>
    <tns:mediator>
      <tns:name>TopNChartMediator4</tns:name>
      <tns:type>topnMediator</tns:type>
    </tns:mediator>
    <tns:title>
      <tns:name>TopNChartTitle4</tns:name>
    </tns:title>
  </tns:widgetConfigInput>
  
  <tns:widgetConfigInput>
    <tns:widget>
      <tns:name>TopNTable5</tns:name>
      <tns:type>table</tns:type>
      <tns:adaptor>PVLcSummaryTableAdaptor</tns:adaptor>
    </tns:widget>
    <tns:mediator>
      <tns:name>TopNMediator5</tns:name>
      <tns:type>topnMediator</tns:type>
    </tns:mediator>
    <tns:title>
      <tns:name>reportTableTitle5</tns:name>
    </tns:title>
  </tns:widgetConfigInput>
  <tns:widgetConfigInput>
    <tns:widget>
      <tns:name>TopNChart5</tns:name>
      <tns:type>chart</tns:type>
    </tns:widget>
    <tns:mediator>
      <tns:name>TopNChartMediator5</tns:name>
      <tns:type>topnMediator</tns:type>
    </tns:mediator>
    <tns:title>
      <tns:name>TopNChartTitle5</tns:name>
    </tns:title>
  </tns:widgetConfigInput>
  
  <tns:widgetConfigInput>
    <tns:widget>
      <tns:name>TopNTable6</tns:name>
      <tns:type>table</tns:type>
      <tns:adaptor>PVLcSummaryTableAdaptor</tns:adaptor>
    </tns:widget>
    <tns:mediator>
      <tns:name>TopNMediator6</tns:name>
      <tns:type>topnMediator</tns:type>
    </tns:mediator>
    <tns:title>
      <tns:name>reportTableTitle6</tns:name>
    </tns:title>
  </tns:widgetConfigInput>
  <tns:widgetConfigInput>
    <tns:widget>
      <tns:name>TopNChart6</tns:name>
      <tns:type>chart</tns:type>
    </tns:widget>
    <tns:mediator>
      <tns:name>TopNChartMediator6</tns:name>
      <tns:type>topnMediator</tns:type>
    </tns:mediator>
    <tns:title>
      <tns:name>TopNChartTitle6</tns:name>
    </tns:title>
  </tns:widgetConfigInput>
  
  
  
 
</tns:reporterInput>
