<?xml version="1.0" encoding="UTF-8"?>
<tns:reporterInput xmlns:tns="com.ibm.csi.npm.dvreportinput" xmlns:xsi="http://www.w3.org/2001/XMLSchema-instance" xsi:schemaLocation="com.ibm.csi.npm.dvreportinput input.xsd ">
  <tns:reporterId>95079</tns:reporterId>
  <tns:widgetConfigInput>
    <tns:widget>
      <tns:name>Chart1</tns:name>
      <tns:type>chart</tns:type>
    </tns:widget>
    <tns:mediator>
      <tns:name>Chart1Mediator</tns:name>
      <tns:type>timeSeriesMediator</tns:type>
    </tns:mediator>
    <tns:title>
      <tns:name>startTime</tns:name>
    </tns:title>
  </tns:widgetConfigInput>
</tns:reporterInput>
