<?xml version="1.0" encoding="UTF-8"?>
<tns:reporterInput xmlns:tns="com.ibm.csi.npm.dvreportinput" xmlns:xsi="http://www.w3.org/2001/XMLSchema-instance" xsi:schemaLocation="com.ibm.csi.npm.dvreportinput input.xsd ">
  <tns:reporterId>95071</tns:reporterId> 
    <tns:widgetConfigInput>
    <tns:widget>
      <tns:name>GTSChart2</tns:name>
      <tns:type>chart</tns:type>
    </tns:widget>
    <tns:mediator>
      <tns:name>GTSMediator2</tns:name>
      <tns:type>timeSeriesMediator</tns:type>
    </tns:mediator>
  </tns:widgetConfigInput>
  
    <tns:widgetConfigInput>
    <tns:widget>
      <tns:name>GTSChart4</tns:name>
      <tns:type>chart</tns:type>
    </tns:widget>
    <tns:mediator>
      <tns:name>GTSMediator4</tns:name>
      <tns:type>timeSeriesMediator</tns:type>
    </tns:mediator>
  </tns:widgetConfigInput>
  
  <tns:widgetConfigInput>
    <tns:widget>
      <tns:name>RatioChart1</tns:name>
      <tns:type>chart</tns:type>
    </tns:widget>
    <tns:mediator>
      <tns:name>RatioMediator1</tns:name>
      <tns:type>ratioMediator</tns:type>
    </tns:mediator>
  </tns:widgetConfigInput>
  
  <tns:widgetConfigInput>
    <tns:widget>
      <tns:name>RatioChart2</tns:name>
      <tns:type>chart</tns:type>
    </tns:widget>
    <tns:mediator>
      <tns:name>RatioMediator2</tns:name>
      <tns:type>ratioMediator</tns:type>
    </tns:mediator>
  </tns:widgetConfigInput>
  
  <tns:widgetConfigInput>
    <tns:widget>
      <tns:name>RatioChart3</tns:name>
      <tns:type>chart</tns:type>
    </tns:widget>
    <tns:mediator>
      <tns:name>RatioMediator3</tns:name>
      <tns:type>ratioMediator</tns:type>
    </tns:mediator>
  </tns:widgetConfigInput>
  
  <tns:widgetConfigInput>
    <tns:widget>
      <tns:name>RatioChart4</tns:name>
      <tns:type>chart</tns:type>
    </tns:widget>
    <tns:mediator>
      <tns:name>RatioMediator4</tns:name>
      <tns:type>ratioMediator</tns:type>
    </tns:mediator>
  </tns:widgetConfigInput>
   <tns:widgetConfigInput>
    <tns:widget>
      <tns:name>ResDistribChart1</tns:name>
      <tns:type>chart</tns:type>
    </tns:widget>
    <tns:mediator>
      <tns:name>ResDistribMediator1</tns:name>
      <tns:type>resourceDistributionMediator</tns:type>
    </tns:mediator>
  </tns:widgetConfigInput>
  
   <tns:widgetConfigInput>
    <tns:widget>
      <tns:name>ResDistribChart2</tns:name>
      <tns:type>chart</tns:type>
    </tns:widget>
    <tns:mediator>
      <tns:name>ResDistribMediator2</tns:name>
      <tns:type>resourceDistributionMediator</tns:type>
    </tns:mediator>
  </tns:widgetConfigInput>
  
   <tns:widgetConfigInput>
    <tns:widget>
      <tns:name>ResDistribChart3</tns:name>
      <tns:type>chart</tns:type>
    </tns:widget>
    <tns:mediator>
      <tns:name>ResDistribMediator3</tns:name>
      <tns:type>resourceDistributionMediator</tns:type>
    </tns:mediator>
  </tns:widgetConfigInput>
  
    <tns:widgetConfigInput>
    <tns:widget>
      <tns:name>TopNTable1</tns:name>
      <tns:type>table</tns:type>
      <tns:adaptor>PVLcSummaryTableAdaptor</tns:adaptor>
    </tns:widget>
    <tns:mediator>
      <tns:name>TopNMediator1</tns:name>
      <tns:type>topnMediator</tns:type>
    </tns:mediator>
  </tns:widgetConfigInput>
  
   <tns:widgetConfigInput>
    <tns:widget>
      <tns:name>TopNTable2</tns:name>
      <tns:type>table</tns:type>
      <tns:adaptor>PVLcSummaryTableAdaptor</tns:adaptor>
    </tns:widget>
    <tns:mediator>
      <tns:name>TopNMediator2</tns:name>
      <tns:type>topnMediator</tns:type>
    </tns:mediator>
  </tns:widgetConfigInput>
  
 
  
</tns:reporterInput>