<?xml version="1.0" encoding="UTF-8"?>
<tns:reporterInput xmlns:tns="com.ibm.csi.npm.dvreportinput" xmlns:xsi="http://www.w3.org/2001/XMLSchema-instance" xsi:schemaLocation="com.ibm.csi.npm.dvreportinput input.xsd ">
  <tns:reporterId>10331</tns:reporterId>
  <tns:widgetConfigInput>
    <tns:widget>
      <tns:name>ResDistribChart1</tns:name>
      <tns:type>chart</tns:type>
    </tns:widget>
    <tns:mediator>
      <tns:name>ResDistribMediator1</tns:name>
      <tns:type>resourceDistributionMediator</tns:type>
    </tns:mediator>
  </tns:widgetConfigInput>
  
  <tns:widgetConfigInput>
    <tns:widget>
      <tns:name>ResDistribChart2</tns:name>
      <tns:type>chart</tns:type>
    </tns:widget>
    <tns:mediator>
      <tns:name>ResDistribMediator2</tns:name>
      <tns:type>resourceDistributionMediator</tns:type>
    </tns:mediator>
  </tns:widgetConfigInput>
  
  <tns:widgetConfigInput>
    <tns:widget>
      <tns:name>statsTable</tns:name>
      <tns:type>table</tns:type>
      <tns:adaptor>PVLcResourceSummaryTableAdaptor</tns:adaptor>
    </tns:widget>
    <tns:mediator>
      <tns:name>statsTableMediator</tns:name>
      <tns:type>rstMediator</tns:type>
    </tns:mediator>
    <tns:title>
      <tns:name>reportTableTitle</tns:name>
    </tns:title>
  </tns:widgetConfigInput>
 
</tns:reporterInput>
