<?xml version="1.0" encoding="UTF-8"?>
<tns:reporterInput xmlns:tns="com.ibm.csi.npm.dvreportinput" xmlns:xsi="http://www.w3.org/2001/XMLSchema-instance" xsi:schemaLocation="com.ibm.csi.npm.dvreportinput input.xsd ">
  <tns:reporterId>10267</tns:reporterId>
   <tns:widgetConfigInput>
    <tns:widget>
      <tns:name>Table1</tns:name>
      <tns:type>table</tns:type>
      <tns:adaptor>PVLcResourceSummaryTableAdaptor</tns:adaptor>
    </tns:widget>
    <tns:mediator>
      <tns:name>Table1Mediator</tns:name>
      <tns:type>rstMediator</tns:type>
    </tns:mediator>
    <tns:title>
      <tns:name>TableTitle1</tns:name>
    </tns:title>
  </tns:widgetConfigInput>
   <tns:widgetConfigInput>
    <tns:widget>
      <tns:name>Table2</tns:name>
      <tns:type>table</tns:type>
      <tns:adaptor>PVLcResourceSummaryTableAdaptor</tns:adaptor>
    </tns:widget>
    <tns:mediator>
      <tns:name>Table2Mediator</tns:name>
      <tns:type>rstMediator</tns:type>
    </tns:mediator>
    <tns:title>
      <tns:name>TableTitle2</tns:name>
    </tns:title>
  </tns:widgetConfigInput>
   <tns:widgetConfigInput>
    <tns:widget>
      <tns:name>Table3</tns:name>
      <tns:type>table</tns:type>
      <tns:adaptor>PVLcResourceSummaryTableAdaptor</tns:adaptor>
    </tns:widget>
    <tns:mediator>
      <tns:name>Table3Mediator</tns:name>
      <tns:type>rstMediator</tns:type>
    </tns:mediator>
    <tns:title>
      <tns:name>TableTitle3</tns:name>
    </tns:title>
  </tns:widgetConfigInput>
   <tns:widgetConfigInput>
    <tns:widget>
      <tns:name>Table4</tns:name>
      <tns:type>table</tns:type>
      <tns:adaptor>PVLcResourceSummaryTableAdaptor</tns:adaptor>
    </tns:widget>
    <tns:mediator>
      <tns:name>Table4Mediator</tns:name>
      <tns:type>rstMediator</tns:type>
    </tns:mediator>
    <tns:title>
      <tns:name>TableTitle4</tns:name>
 	</tns:title>
       </tns:widgetConfigInput>
     <tns:widgetConfigInput>
    <tns:widget>
      <tns:name>Table5</tns:name>
      <tns:type>table</tns:type>
      <tns:adaptor>PVLcResourceSummaryTableAdaptor</tns:adaptor>
    </tns:widget>
    <tns:mediator>
      <tns:name>Table5Mediator</tns:name>
      <tns:type>rstMediator</tns:type>
    </tns:mediator>
    <tns:title>
      <tns:name>TableTitle5</tns:name>
    </tns:title>
  </tns:widgetConfigInput>
   <tns:widgetConfigInput>
    <tns:widget>
      <tns:name>Table6</tns:name>
      <tns:type>table</tns:type>
      <tns:adaptor>PVLcResourceSummaryTableAdaptor</tns:adaptor>
    </tns:widget>
    <tns:mediator>
      <tns:name>Table6Mediator</tns:name>
      <tns:type>rstMediator</tns:type>
    </tns:mediator>
    <tns:title>
      <tns:name>TableTitle6</tns:name>
    </tns:title>
  </tns:widgetConfigInput>
  
   <tns:widgetConfigInput>
    <tns:widget>
      <tns:name>Chart1</tns:name>
      <tns:type>chart</tns:type>
    </tns:widget>
    <tns:mediator>
      <tns:name>Chart1Mediator</tns:name>
      <tns:type>timeSeriesMediator</tns:type>
    </tns:mediator>
    <tns:title>
      <tns:name>ChartTitle1</tns:name>
    </tns:title>
  </tns:widgetConfigInput>
   <tns:widgetConfigInput>
    <tns:widget>
      <tns:name>Chart2</tns:name>
      <tns:type>chart</tns:type>
    </tns:widget>
    <tns:mediator>
      <tns:name>Chart2Mediator</tns:name>
      <tns:type>timeSeriesMediator</tns:type>
    </tns:mediator>
    <tns:title>
      <tns:name>ChartTitle2</tns:name>
    </tns:title>
  </tns:widgetConfigInput>
   <tns:widgetConfigInput>
    <tns:widget>
      <tns:name>Chart3</tns:name>
      <tns:type>chart</tns:type>
    </tns:widget>
    <tns:mediator>
      <tns:name>Chart3Mediator</tns:name>
      <tns:type>timeSeriesMediator</tns:type>
    </tns:mediator>
    <tns:title>
      <tns:name>ChartTitle3</tns:name>
    </tns:title>
  </tns:widgetConfigInput>
   <tns:widgetConfigInput>
    <tns:widget>
      <tns:name>Chart4</tns:name>
      <tns:type>chart</tns:type>
    </tns:widget>
    <tns:mediator>
      <tns:name>Chart4Mediator</tns:name>
      <tns:type>timeSeriesMediator</tns:type>
    </tns:mediator>
    <tns:title>
      <tns:name>ChartTitle4</tns:name>
    </tns:title>
  </tns:widgetConfigInput>
   <tns:widgetConfigInput>
    <tns:widget>
      <tns:name>Chart5</tns:name>
      <tns:type>chart</tns:type>
    </tns:widget>
    <tns:mediator>
      <tns:name>Chart5Mediator</tns:name>
      <tns:type>timeSeriesMediator</tns:type>
    </tns:mediator>
    <tns:title>
      <tns:name>ChartTitle5</tns:name>
    </tns:title>
  </tns:widgetConfigInput>
   <tns:widgetConfigInput>
    <tns:widget>
      <tns:name>Chart6</tns:name>
      <tns:type>chart</tns:type>
    </tns:widget>
    <tns:mediator>
      <tns:name>Chart6Mediator</tns:name>
      <tns:type>timeSeriesMediator</tns:type>
    </tns:mediator>
    <tns:title>
      <tns:name>ChartTitle6</tns:name>
    </tns:title>
  </tns:widgetConfigInput>
 
</tns:reporterInput>
