<?xml version="1.0" encoding="UTF-8"?>
<tns:reporterInput xmlns:tns="com.ibm.csi.npm.dvreportinput" xmlns:xsi="http://www.w3.org/2001/XMLSchema-instance" xsi:schemaLocation="com.ibm.csi.npm.dvreportinput input.xsd ">
  <tns:reporterId>10267</tns:reporterId>
   <tns:widgetConfigInput>
    <tns:widget>
      <tns:name>Chart1</tns:name>
      <tns:type>chart</tns:type>
    </tns:widget>
    <tns:mediator>
      <tns:name>Chart1Mediator</tns:name>
      <tns:type>timeSeriesMediator</tns:type>
    </tns:mediator>
    <tns:title>
      <tns:name>Chart1Title</tns:name>
    </tns:title>
  </tns:widgetConfigInput>
   <tns:widgetConfigInput>
    <tns:widget>
      <tns:name>Chart2</tns:name>
      <tns:type>chart</tns:type>
    </tns:widget>
    <tns:mediator>
      <tns:name>Chart2Mediator</tns:name>
      <tns:type>timeSeriesMediator</tns:type>
    </tns:mediator>
    <tns:title>
      <tns:name>Chart2Title</tns:name>
    </tns:title>
  </tns:widgetConfigInput>
   <tns:widgetConfigInput>
    <tns:widget>
      <tns:name>Chart3</tns:name>
      <tns:type>chart</tns:type>
    </tns:widget>
    <tns:mediator>
      <tns:name>Chart3Mediator</tns:name>
      <tns:type>timeSeriesMediator</tns:type>
    </tns:mediator>
    <tns:title>
      <tns:name>Chart3Title</tns:name>
    </tns:title>
  </tns:widgetConfigInput>
   <tns:widgetConfigInput>
    <tns:widget>
      <tns:name>Chart4</tns:name>
      <tns:type>chart</tns:type>
    </tns:widget>
    <tns:mediator>
      <tns:name>Chart4Mediator</tns:name>
      <tns:type>timeSeriesMediator</tns:type>
    </tns:mediator>
    <tns:title>
      <tns:name>Chart4Title</tns:name>
    </tns:title>
  </tns:widgetConfigInput>
   <tns:widgetConfigInput>
    <tns:widget>
      <tns:name>Chart5</tns:name>
      <tns:type>chart</tns:type>
    </tns:widget>
    <tns:mediator>
      <tns:name>Chart5Mediator</tns:name>
      <tns:type>timeSeriesMediator</tns:type>
    </tns:mediator>
    <tns:title>
      <tns:name>Chart5Title</tns:name>
    </tns:title>
  </tns:widgetConfigInput>
   <tns:widgetConfigInput>
    <tns:widget>
      <tns:name>Chart6</tns:name>
      <tns:type>chart</tns:type>
    </tns:widget>
    <tns:mediator>
      <tns:name>Chart6Mediator</tns:name>
      <tns:type>timeSeriesMediator</tns:type>
    </tns:mediator>
    <tns:title>
      <tns:name>Chart6Title</tns:name>
    </tns:title>
  </tns:widgetConfigInput>
  
  <tns:widgetConfigInput>
    <tns:widget>
      <tns:name>Chart1LED</tns:name>
      <tns:type>chart</tns:type>
    </tns:widget>
    <tns:mediator>
      <tns:name>Chart1LEDMediator</tns:name>
      <tns:type>timeSeriesMediator</tns:type>
    </tns:mediator>
    <tns:title>
      <tns:name>Chart1TitlePlain</tns:name>
    </tns:title>
  </tns:widgetConfigInput>
   <tns:widgetConfigInput>
    <tns:widget>
      <tns:name>Chart2LED</tns:name>
      <tns:type>chart</tns:type>
    </tns:widget>
    <tns:mediator>
      <tns:name>Chart2LEDMediator</tns:name>
      <tns:type>timeSeriesMediator</tns:type>
    </tns:mediator>
    <tns:title>
      <tns:name>Chart2TitlePlain</tns:name>
    </tns:title>
  </tns:widgetConfigInput>
   <tns:widgetConfigInput>
    <tns:widget>
      <tns:name>Chart3LED</tns:name>
      <tns:type>chart</tns:type>
    </tns:widget>
    <tns:mediator>
      <tns:name>Chart3LEDMediator</tns:name>
      <tns:type>timeSeriesMediator</tns:type>
    </tns:mediator>
    <tns:title>
      <tns:name>Chart3TitlePlain</tns:name>
    </tns:title>
  </tns:widgetConfigInput>
   <tns:widgetConfigInput>
    <tns:widget>
      <tns:name>Chart4LED</tns:name>
      <tns:type>chart</tns:type>
    </tns:widget>
    <tns:mediator>
      <tns:name>Chart4LEDMediator</tns:name>
      <tns:type>timeSeriesMediator</tns:type>
    </tns:mediator>
    <tns:title>
      <tns:name>Chart4TitlePlain</tns:name>
    </tns:title>
  </tns:widgetConfigInput>
   <tns:widgetConfigInput>
    <tns:widget>
      <tns:name>Chart5LED</tns:name>
      <tns:type>chart</tns:type>
    </tns:widget>
    <tns:mediator>
      <tns:name>Chart5LEDMediator</tns:name>
      <tns:type>timeSeriesMediator</tns:type>
    </tns:mediator>
    <tns:title>
      <tns:name>Chart5TitlePlain</tns:name>
    </tns:title>
  </tns:widgetConfigInput>
   <tns:widgetConfigInput>
    <tns:widget>
      <tns:name>Chart6LED</tns:name>
      <tns:type>chart</tns:type>
    </tns:widget>
    <tns:mediator>
      <tns:name>Chart6LEDMediator</tns:name>
      <tns:type>timeSeriesMediator</tns:type>
    </tns:mediator>
    <tns:title>
      <tns:name>Chart6titlePlain</tns:name>
    </tns:title>
  </tns:widgetConfigInput>
 
</tns:reporterInput>
