<?xml version="1.0" encoding="UTF-8"?>
<tns:reporterInput xmlns:tns="com.ibm.csi.npm.dvreportinput" xmlns:xsi="http://www.w3.org/2001/XMLSchema-instance" xsi:schemaLocation="com.ibm.csi.npm.dvreportinput input.xsd ">
  <tns:reporterId>78007</tns:reporterId>
  <tns:widgetConfigInput>
    <tns:widget>
      <tns:name>MatrixTable</tns:name>
      <tns:type>table</tns:type>
      <tns:adaptor>MatrixAdaptor</tns:adaptor>
    </tns:widget>
    <tns:mediator>
      <tns:name>MatrixMediator</tns:name>
      <tns:type>MatrixMediator</tns:type>
    </tns:mediator>
    <tns:title>
      <tns:name>MatrixTitle</tns:name>
    </tns:title>
  </tns:widgetConfigInput>
</tns:reporterInput>
