<?xml version="1.0" encoding="UTF-8"?>
<tns:reporterInput xmlns:tns="com.ibm.csi.npm.dvreportinput" xmlns:xsi="http://www.w3.org/2001/XMLSchema-instance" xsi:schemaLocation="com.ibm.csi.npm.dvreportinput input.xsd ">
  <tns:reporterId>100000896</tns:reporterId>
  <tns:widgetConfigInput>
    <tns:widget>
      <tns:name>BaselineChart1</tns:name>
      <tns:type>chart</tns:type>
    </tns:widget>
    <tns:mediator>
      <tns:name>BaselineMediator1</tns:name>
      <tns:type>baselineMediator</tns:type>
    </tns:mediator>
  </tns:widgetConfigInput>
</tns:reporterInput>