<?xml version="1.0" encoding="UTF-8"?>
<tns:reporterInput xmlns:tns="com.ibm.csi.npm.dvreportinput" xmlns:xsi="http://www.w3.org/2001/XMLSchema-instance" xsi:schemaLocation="com.ibm.csi.npm.dvreportinput input.xsd ">
  <tns:reporterId>69143</tns:reporterId>
  <tns:widgetConfigInput>
    <tns:widget>
      <tns:name>GroupSummary1Table</tns:name>
      <tns:type>table</tns:type>
      <tns:adaptor>PVLcGroupSummaryTableAdaptor</tns:adaptor>
    </tns:widget>
    <tns:mediator>
      <tns:name>groupSummaryTableMediator</tns:name>
      <tns:type>gstMediator</tns:type>
    </tns:mediator>   
    <tns:title>
      <tns:name>reportTableTitle</tns:name>
    </tns:title>  
  </tns:widgetConfigInput> 
</tns:reporterInput>
