<?xml version="1.0" encoding="UTF-8"?>
<tns:reporterInput xmlns:tns="com.ibm.csi.npm.dvreportinput" xmlns:xsi="http://www.w3.org/2001/XMLSchema-instance" xsi:schemaLocation="com.ibm.csi.npm.dvreportinput input.xsd ">
  <tns:reporterId>25770</tns:reporterId>
    <tns:widgetConfigInput>
    <tns:widget>
      <tns:name>GroupSummaryTable</tns:name>
      <tns:type>table</tns:type>
      <tns:adaptor>PVLcGroupSummaryTableAdaptor</tns:adaptor>
    </tns:widget>
    <tns:mediator>
      <tns:name>GroupSummaryMediator</tns:name>
      <tns:type>gstMediator</tns:type>
    </tns:mediator>   
    <tns:title>
      <tns:name>GroupSummaryTitle</tns:name>
    </tns:title>  
  </tns:widgetConfigInput> 
  <tns:widgetConfigInput>
    <tns:widget>
      <tns:name>GTS1Chart</tns:name>
      <tns:type>chart</tns:type>
    </tns:widget>
    <tns:mediator>
      <tns:name>GTS1Mediator</tns:name>
      <tns:type>timeSeriesMediator</tns:type>
    </tns:mediator>
    <tns:title>
      <tns:name>GroupTimeSeries1Title</tns:name>
    </tns:title>
  </tns:widgetConfigInput>
  
   <tns:widgetConfigInput>
    <tns:widget>
      <tns:name>GTS2Chart</tns:name>
      <tns:type>chart</tns:type>
    </tns:widget>
    <tns:mediator>
      <tns:name>GTS2Mediator</tns:name>
      <tns:type>timeSeriesMediator</tns:type>
    </tns:mediator>
    <tns:title>
      <tns:name>GroupTimeSeries2Title</tns:name>
    </tns:title>
  </tns:widgetConfigInput>
  
  <tns:widgetConfigInput>
    <tns:widget>
      <tns:name>TopN1Table</tns:name>
      <tns:type>table</tns:type>
      <tns:adaptor>PVLcSummaryTableAdaptor</tns:adaptor>
    </tns:widget>
    <tns:mediator>
      <tns:name>TopN1Mediator</tns:name>
      <tns:type>topnMediator</tns:type>
    </tns:mediator>   
    <tns:title>
      <tns:name>TopN1Title</tns:name>
    </tns:title>  
  </tns:widgetConfigInput>  
  
  <tns:widgetConfigInput>
    <tns:widget>
      <tns:name>TopN2Table</tns:name>
      <tns:type>table</tns:type>
      <tns:adaptor>PVLcSummaryTableAdaptor</tns:adaptor>
    </tns:widget>
    <tns:mediator>
      <tns:name>TopN2Mediator</tns:name>
      <tns:type>topnMediator</tns:type>
    </tns:mediator>   
    <tns:title>
      <tns:name>TopN2Title</tns:name>
    </tns:title>  
  </tns:widgetConfigInput>  
  
    <tns:widgetConfigInput>
    <tns:widget>
      <tns:name>Ratio1Chart</tns:name>
      <tns:type>chart</tns:type>
    </tns:widget>
    <tns:mediator>
      <tns:name>Ratio1Mediator</tns:name>
      <tns:type>ratioMediator</tns:type>
    </tns:mediator>
    <tns:title>
      <tns:name>Ratio1Title</tns:name>
    </tns:title>
  </tns:widgetConfigInput>
  
   <tns:widgetConfigInput>
    <tns:widget>
      <tns:name>Ratio2Chart</tns:name>
      <tns:type>chart</tns:type>
    </tns:widget>
    <tns:mediator>
      <tns:name>Ratio2Mediator</tns:name>
      <tns:type>ratioMediator</tns:type>
    </tns:mediator>
    <tns:title>
      <tns:name>Ratio2Title</tns:name>
    </tns:title>
  </tns:widgetConfigInput>

  </tns:reporterInput>

