<?xml version="1.0" encoding="UTF-8"?>
<tns:reporterInput xmlns:tns="com.ibm.csi.npm.dvreportinput" xmlns:xsi="http://www.w3.org/2001/XMLSchema-instance" xsi:schemaLocation="com.ibm.csi.npm.dvreportinput input.xsd ">
  <tns:reporterId>25645</tns:reporterId>
  <tns:widgetConfigInput>
    <tns:widget>
      <tns:name>GroupTimeSeries1Chart</tns:name>
      <tns:type>chart</tns:type>
    </tns:widget>
    <tns:mediator>
      <tns:name>GroupTimeSeries1Mediator</tns:name>
      <tns:type>timeSeriesMediator</tns:type>
    </tns:mediator>
    <tns:title>
      <tns:name>GroupTimeSeries1Title</tns:name>
    </tns:title>
  </tns:widgetConfigInput>
  <tns:widgetConfigInput>
    <tns:widget>
      <tns:name>GroupTimeSeries2Chart</tns:name>
      <tns:type>chart</tns:type>
    </tns:widget>
    <tns:mediator>
      <tns:name>GroupTimeSeries2Mediator</tns:name>
      <tns:type>timeSeriesMediator</tns:type>
    </tns:mediator>
    <tns:title>
      <tns:name>GroupTimeSeries2Title</tns:name>
    </tns:title>
  </tns:widgetConfigInput>
   <tns:widgetConfigInput>
    <tns:widget>
      <tns:name>GroupTimeSeries3Chart</tns:name>
      <tns:type>chart</tns:type>
    </tns:widget>
    <tns:mediator>
      <tns:name>GroupTimeSeries3Mediator</tns:name>
      <tns:type>timeSeriesMediator</tns:type>
    </tns:mediator>
    <tns:title>
      <tns:name>GroupTimeSeries3Title</tns:name>
    </tns:title>
  </tns:widgetConfigInput>
  <tns:widgetConfigInput>
    <tns:widget>
      <tns:name>GroupTimeSeries4Chart</tns:name>
      <tns:type>chart</tns:type>
    </tns:widget>
    <tns:mediator>
      <tns:name>GroupTimeSeries4Mediator</tns:name>
      <tns:type>timeSeriesMediator</tns:type>
    </tns:mediator>
    <tns:title>
      <tns:name>GroupTimeSeries4Title</tns:name>
    </tns:title>
  </tns:widgetConfigInput>
   <tns:widgetConfigInput>
    <tns:widget>
      <tns:name>GroupTimeSeries5Chart</tns:name>
      <tns:type>chart</tns:type>
    </tns:widget>
    <tns:mediator>
      <tns:name>GroupTimeSeries5Mediator</tns:name>
      <tns:type>timeSeriesMediator</tns:type>
    </tns:mediator>
    <tns:title>
      <tns:name>GroupTimeSeries5Title</tns:name>
    </tns:title>
  </tns:widgetConfigInput>
  <tns:widgetConfigInput>
    <tns:widget>
      <tns:name>GroupTimeSeries6Chart</tns:name>
      <tns:type>chart</tns:type>
    </tns:widget>
    <tns:mediator>
      <tns:name>GroupTimeSeries6Mediator</tns:name>
      <tns:type>timeSeriesMediator</tns:type>
    </tns:mediator>
    <tns:title>
      <tns:name>GroupTimeSeries6Title</tns:name>
    </tns:title>
  </tns:widgetConfigInput>
 
 
  
</tns:reporterInput>
